{
  "$schema": "https://json-schema.org/draft/2020-12/schema",
  "$id": "urn:qc2:schema:qc2.identity_market.SymbolAssignment.v1",
  "title": "SymbolAssignment",
  "description": "Strict persisted QC2 contract qc2.identity_market.SymbolAssignment.v1. Unknown properties and coercion are forbidden.",
  "type": "object",
  "properties": {
    "schema_name": {
      "type": "string",
      "const": "qc2.identity_market.SymbolAssignment.v1"
    },
    "schema_version": {
      "type": "string",
      "const": "1.0"
    },
    "id": {
      "type": "string",
      "pattern": "^[0-9a-f]{8}-[0-9a-f]{4}-7[0-9a-f]{3}-[89ab][0-9a-f]{3}-[0-9a-f]{12}$"
    },
    "created_at": {
      "type": "string",
      "format": "date-time",
      "pattern": "^\\d{4}-\\d{2}-\\d{2}T\\d{2}:\\d{2}:\\d{2}(?:\\.\\d{1,9})?(?:Z|\\+00:00)$"
    },
    "owning_authority": {
      "type": "string",
      "const": "instrument_universe"
    },
    "evidence_class": {
      "type": "string",
      "enum": [
        "SYNTHETIC_FIXTURE",
        "HISTORICAL_RECONSTRUCTED",
        "FORWARD_OPERATIONAL",
        "FORWARD_SEALED"
      ]
    },
    "environment_namespace": {
      "type": "string",
      "enum": [
        "development",
        "test",
        "research",
        "production"
      ]
    },
    "source_refs": {
      "type": "array",
      "items": {
        "type": "object",
        "properties": {
          "target_schema_name": {
            "type": "string",
            "enum": [
              "qc2.time_operation.CalendarManifest.v1",
              "qc2.time_operation.CalendarRevision.v1",
              "qc2.time_operation.MarketSession.v1",
              "qc2.time_operation.ClockAssessment.v1",
              "qc2.time_operation.JobDefinition.v1",
              "qc2.time_operation.JobLease.v1",
              "qc2.time_operation.JobAttempt.v1",
              "qc2.time_operation.OutboxMessage.v1",
              "qc2.time_operation.ReadinessAssessment.v1",
              "qc2.time_operation.DeploymentCapabilityManifest.v1",
              "qc2.identity_market.Instrument.v1",
              "qc2.identity_market.SymbolAssignment.v1",
              "qc2.identity_market.InstrumentClassification.v1",
              "qc2.identity_market.CorporateActionRecord.v1",
              "qc2.identity_market.AdjustmentManifest.v1",
              "qc2.identity_market.CandidateCensus.v1",
              "qc2.identity_market.DailyBar.v1",
              "qc2.identity_market.RawReceipt.v1",
              "qc2.identity_market.RequestManifest.v1",
              "qc2.identity_market.DataCapabilityManifest.v1",
              "qc2.identity_market.BarSemanticsManifest.v1",
              "qc2.identity_market.DataBundle.v1",
              "qc2.identity_market.UniverseManifest.v1",
              "qc2.identity_market.MarketSnapshot.v1",
              "qc2.identity_market.MarketSnapshotRevision.v1",
              "qc2.identity_market.QuarantineCase.v1",
              "qc2.scientific_definitions.FeatureDefinition.v1",
              "qc2.scientific_definitions.FeatureRegistry.v1",
              "qc2.scientific_definitions.FeatureSnapshot.v1",
              "qc2.scientific_definitions.RunnerProtocolDefinition.v1",
              "qc2.scientific_definitions.RunnerProtocolRegistry.v1",
              "qc2.scientific_definitions.RunnerProtocolResult.v1",
              "qc2.scientific_definitions.SafetyProtocolDefinition.v1",
              "qc2.scientific_definitions.SafetyProtocolResult.v1",
              "qc2.scientific_definitions.LabelDefinition.v1",
              "qc2.scientific_definitions.LabelRegistry.v1",
              "qc2.scientific_definitions.ScoreDefinition.v1",
              "qc2.scientific_definitions.ScoreManifest.v1",
              "qc2.scientific_definitions.BaselineManifest.v1",
              "qc2.models_prediction.ModelManifest.v1",
              "qc2.models_prediction.ModelHeadDefinition.v1",
              "qc2.models_prediction.ModelHeadOutput.v1",
              "qc2.models_prediction.InferenceReceipt.v1",
              "qc2.models_prediction.PredictionRun.v1",
              "qc2.models_prediction.Prediction.v1",
              "qc2.models_prediction.ScientificPredictionPayload.v1",
              "qc2.models_prediction.PredictionSeal.v1",
              "qc2.models_prediction.RunDisposition.v1",
              "qc2.models_prediction.ShadowPredictionSet.v1",
              "qc2.models_prediction.ReplayRequest.v1",
              "qc2.models_prediction.ReplayReceipt.v1",
              "qc2.outcomes_research.Outcome.v1",
              "qc2.outcomes_research.OutcomeRevision.v1",
              "qc2.outcomes_research.RunnerEvent.v1",
              "qc2.outcomes_research.RunnerGenome.v1",
              "qc2.outcomes_research.FailureGenome.v1",
              "qc2.outcomes_research.MemoryIndexManifest.v1",
              "qc2.outcomes_research.MatchedDecoySet.v1",
              "qc2.outcomes_research.ReviewCase.v1",
              "qc2.outcomes_research.DatasetManifest.v1",
              "qc2.outcomes_research.DatasetRowLineage.v1",
              "qc2.outcomes_research.SplitManifest.v1",
              "qc2.outcomes_research.HoldoutAccessReceipt.v1",
              "qc2.outcomes_research.Experiment.v1",
              "qc2.outcomes_research.CandidateEvaluation.v1",
              "qc2.outcomes_research.ChallengerEvaluation.v1",
              "qc2.outcomes_research.DriftAssessment.v1",
              "qc2.validation.ValidationEpoch.v1",
              "qc2.validation.EpochManifest.v1",
              "qc2.validation.ScheduledAttempt.v1",
              "qc2.validation.ValidationSession.v1",
              "qc2.validation.QualificationReceipt.v1",
              "qc2.validation.MetricDefinition.v1",
              "qc2.validation.MetricResult.v1",
              "qc2.validation.StatisticalAnalysisPlan.v1",
              "qc2.validation.ValidationReport.v1",
              "qc2.validation.ReportAmendment.v1",
              "qc2.execution.StrategyManifest.v1",
              "qc2.execution.CapitalPolicy.v1",
              "qc2.execution.PaperOrderIntent.v1",
              "qc2.execution.IntentDecision.v1",
              "qc2.execution.SubmissionAttempt.v1",
              "qc2.execution.BrokerOrder.v1",
              "qc2.execution.BrokerOrderEvent.v1",
              "qc2.execution.Fill.v1",
              "qc2.execution.FillCorrection.v1",
              "qc2.execution.Position.v1",
              "qc2.execution.CashLedgerEntry.v1",
              "qc2.execution.Reservation.v1",
              "qc2.execution.ReconciliationReport.v1",
              "qc2.execution.ExecutionEpisode.v1",
              "qc2.governance_owner.PromotionPolicy.v1",
              "qc2.governance_owner.PromotionBundleManifest.v1",
              "qc2.governance_owner.PromotionRequest.v1",
              "qc2.governance_owner.PromotionChallenge.v1",
              "qc2.governance_owner.PromotionDecision.v1",
              "qc2.governance_owner.PromotionReceipt.v1",
              "qc2.governance_owner.ChampionPointer.v1",
              "qc2.governance_owner.EpochActivationChallenge.v1",
              "qc2.governance_owner.EpochActivationDecision.v1",
              "qc2.governance_owner.EpochActivationReceipt.v1",
              "qc2.governance_owner.OwnerDevice.v1",
              "qc2.governance_owner.OwnerSession.v1",
              "qc2.governance_owner.EnrollmentChallenge.v1",
              "qc2.governance_owner.RecoveryEvent.v1",
              "qc2.governance_owner.OwnerCommand.v1",
              "qc2.governance_owner.OwnerCommandReceipt.v1",
              "qc2.governance_owner.Alert.v1",
              "qc2.integrity_build.EvidenceEvent.v1",
              "qc2.integrity_build.Checkpoint.v1",
              "qc2.integrity_build.AnchorReceipt.v1",
              "qc2.integrity_build.ArtifactManifest.v1",
              "qc2.integrity_build.ArtifactDependency.v1",
              "qc2.integrity_build.BackupManifest.v1",
              "qc2.integrity_build.RestoreReceipt.v1",
              "qc2.integrity_build.ConfigurationManifest.v1",
              "qc2.integrity_build.ConfigurationSetting.v1",
              "qc2.integrity_build.SecretReference.v1",
              "qc2.integrity_build.ResourceBudget.v1",
              "qc2.integrity_build.UnknownDecision.v1",
              "qc2.integrity_build.ChangeRequest.v1",
              "qc2.integrity_build.ReferenceIntake.v1",
              "qc2.integrity_build.BuildTask.v1",
              "qc2.integrity_build.TaskAcceptanceReceipt.v1"
            ]
          },
          "target_id": {
            "type": "string",
            "pattern": "^[0-9a-f]{8}-[0-9a-f]{4}-7[0-9a-f]{3}-[89ab][0-9a-f]{3}-[0-9a-f]{12}$"
          },
          "content_hash": {
            "type": "string",
            "pattern": "^[0-9a-f]{64}$"
          }
        },
        "required": [
          "target_schema_name",
          "target_id"
        ],
        "additionalProperties": false,
        "allOf": [
          {
            "if": {
              "properties": {
                "target_schema_name": {
                  "enum": [
                    "qc2.integrity_build.ArtifactManifest.v1",
                    "qc2.integrity_build.BackupManifest.v1",
                    "qc2.scientific_definitions.BaselineManifest.v1",
                    "qc2.integrity_build.BuildTask.v1",
                    "qc2.time_operation.CalendarManifest.v1",
                    "qc2.execution.CapitalPolicy.v1",
                    "qc2.integrity_build.ChangeRequest.v1",
                    "qc2.integrity_build.Checkpoint.v1",
                    "qc2.integrity_build.ConfigurationManifest.v1",
                    "qc2.integrity_build.ConfigurationSetting.v1",
                    "qc2.outcomes_research.DatasetManifest.v1",
                    "qc2.outcomes_research.DatasetRowLineage.v1",
                    "qc2.governance_owner.EpochActivationChallenge.v1",
                    "qc2.governance_owner.EpochActivationDecision.v1",
                    "qc2.validation.EpochManifest.v1",
                    "qc2.integrity_build.EvidenceEvent.v1",
                    "qc2.execution.ExecutionEpisode.v1",
                    "qc2.outcomes_research.Experiment.v1",
                    "qc2.outcomes_research.FailureGenome.v1",
                    "qc2.scientific_definitions.FeatureDefinition.v1",
                    "qc2.scientific_definitions.FeatureRegistry.v1",
                    "qc2.scientific_definitions.FeatureSnapshot.v1",
                    "qc2.scientific_definitions.LabelDefinition.v1",
                    "qc2.scientific_definitions.LabelRegistry.v1",
                    "qc2.outcomes_research.MatchedDecoySet.v1",
                    "qc2.outcomes_research.MemoryIndexManifest.v1",
                    "qc2.models_prediction.ModelManifest.v1",
                    "qc2.outcomes_research.Outcome.v1",
                    "qc2.governance_owner.OwnerCommand.v1",
                    "qc2.execution.PaperOrderIntent.v1",
                    "qc2.models_prediction.Prediction.v1",
                    "qc2.models_prediction.PredictionSeal.v1",
                    "qc2.governance_owner.PromotionBundleManifest.v1",
                    "qc2.governance_owner.PromotionChallenge.v1",
                    "qc2.governance_owner.PromotionDecision.v1",
                    "qc2.governance_owner.PromotionPolicy.v1",
                    "qc2.validation.QualificationReceipt.v1",
                    "qc2.integrity_build.ReferenceIntake.v1",
                    "qc2.integrity_build.ResourceBudget.v1",
                    "qc2.outcomes_research.RunnerGenome.v1",
                    "qc2.scientific_definitions.RunnerProtocolDefinition.v1",
                    "qc2.scientific_definitions.RunnerProtocolRegistry.v1",
                    "qc2.scientific_definitions.SafetyProtocolDefinition.v1",
                    "qc2.scientific_definitions.SafetyProtocolResult.v1",
                    "qc2.models_prediction.ScientificPredictionPayload.v1",
                    "qc2.scientific_definitions.ScoreDefinition.v1",
                    "qc2.scientific_definitions.ScoreManifest.v1",
                    "qc2.integrity_build.SecretReference.v1",
                    "qc2.models_prediction.ShadowPredictionSet.v1",
                    "qc2.outcomes_research.SplitManifest.v1",
                    "qc2.validation.StatisticalAnalysisPlan.v1",
                    "qc2.execution.StrategyManifest.v1",
                    "qc2.integrity_build.TaskAcceptanceReceipt.v1",
                    "qc2.validation.ValidationEpoch.v1",
                    "qc2.validation.ValidationReport.v1"
                  ]
                }
              },
              "required": [
                "target_schema_name"
              ]
            },
            "then": {
              "required": [
                "content_hash"
              ]
            }
          }
        ]
      }
    },
    "instrument_ref": {
      "type": "object",
      "properties": {
        "target_schema_name": {
          "const": "qc2.identity_market.Instrument.v1"
        },
        "target_id": {
          "type": "string",
          "pattern": "^[0-9a-f]{8}-[0-9a-f]{4}-7[0-9a-f]{3}-[89ab][0-9a-f]{3}-[0-9a-f]{12}$"
        },
        "content_hash": {
          "type": "string",
          "pattern": "^[0-9a-f]{64}$"
        }
      },
      "required": [
        "target_schema_name",
        "target_id"
      ],
      "additionalProperties": false,
      "description": "Unit: typed foreign reference to the listed contract.",
      "x-unit": "typed foreign reference to the listed contract"
    },
    "symbol": {
      "type": "string",
      "pattern": "^[A-Z0-9][A-Z0-9.-]{0,15}$",
      "description": "Unit: provider symbol.",
      "x-unit": "provider symbol"
    },
    "exchange": {
      "type": "string",
      "minLength": 1,
      "description": "Unit: text.",
      "x-unit": "text"
    },
    "currency": {
      "type": "string",
      "pattern": "^[A-Z]{3}$",
      "description": "Unit: ISO 4217 currency code.",
      "x-unit": "ISO 4217 currency code"
    },
    "effective_from": {
      "type": "string",
      "format": "date",
      "pattern": "^\\d{4}-\\d{2}-\\d{2}$",
      "description": "Unit: exchange session date (YYYY-MM-DD).",
      "x-unit": "exchange session date (YYYY-MM-DD)"
    },
    "effective_to": {
      "anyOf": [
        {
          "type": "string",
          "format": "date",
          "pattern": "^\\d{4}-\\d{2}-\\d{2}$"
        },
        {
          "type": "null"
        }
      ],
      "description": "Unit: exchange session date (YYYY-MM-DD).",
      "x-unit": "exchange session date (YYYY-MM-DD)"
    },
    "known_from": {
      "type": "string",
      "format": "date-time",
      "pattern": "^\\d{4}-\\d{2}-\\d{2}T\\d{2}:\\d{2}:\\d{2}(?:\\.\\d{1,9})?(?:Z|\\+00:00)$",
      "description": "Unit: UTC instant.",
      "x-unit": "UTC instant"
    },
    "known_to": {
      "anyOf": [
        {
          "type": "string",
          "format": "date-time",
          "pattern": "^\\d{4}-\\d{2}-\\d{2}T\\d{2}:\\d{2}:\\d{2}(?:\\.\\d{1,9})?(?:Z|\\+00:00)$"
        },
        {
          "type": "null"
        }
      ],
      "description": "Unit: UTC instant.",
      "x-unit": "UTC instant"
    },
    "source_evidence_ref": {
      "type": "object",
      "properties": {
        "target_schema_name": {
          "const": "qc2.integrity_build.EvidenceEvent.v1"
        },
        "target_id": {
          "type": "string",
          "pattern": "^[0-9a-f]{8}-[0-9a-f]{4}-7[0-9a-f]{3}-[89ab][0-9a-f]{3}-[0-9a-f]{12}$"
        },
        "content_hash": {
          "type": "string",
          "pattern": "^[0-9a-f]{64}$"
        }
      },
      "required": [
        "target_schema_name",
        "target_id",
        "content_hash"
      ],
      "additionalProperties": false,
      "description": "Unit: typed foreign reference to the listed contract.",
      "x-unit": "typed foreign reference to the listed contract"
    },
    "mapping_confidence": {
      "type": "string",
      "pattern": "^(?:0\\.[0-9]{12}|1\\.0{12}|-0\\.0{12})$",
      "description": "Unit: probability, fraction in [0, 1].",
      "x-unit": "probability, fraction in [0, 1]"
    }
  },
  "required": [
    "schema_name",
    "schema_version",
    "id",
    "created_at",
    "owning_authority",
    "evidence_class",
    "environment_namespace",
    "source_refs",
    "instrument_ref",
    "symbol",
    "exchange",
    "currency",
    "effective_from",
    "effective_to",
    "known_from",
    "known_to",
    "source_evidence_ref",
    "mapping_confidence"
  ],
  "additionalProperties": false,
  "x-qc2": {
    "family": "Identity and market",
    "family_slug": "identity_market",
    "schema_name": "qc2.identity_market.SymbolAssignment.v1",
    "writer_role": "instrument_universe",
    "reader_roles": [
      "apexlab",
      "core",
      "evidence",
      "feature",
      "ground_truth",
      "instrument_universe",
      "market_data",
      "prediction",
      "universe",
      "validation"
    ],
    "identity_fields": [
      "id",
      "instrument_ref",
      "symbol",
      "effective_from",
      "known_from"
    ],
    "content_addressed": false,
    "content_hash_fields": [],
    "content_hash_excluded_fields": [],
    "scientific_payload_fields": [],
    "operational_envelope_fields": [],
    "android_visible": false,
    "state_field": null,
    "state_transitions": {},
    "state_guard": null,
    "immutable_fields": [
      "schema_name",
      "schema_version",
      "id",
      "created_at",
      "owning_authority",
      "evidence_class",
      "environment_namespace",
      "source_refs",
      "instrument_ref",
      "symbol",
      "exchange",
      "currency",
      "effective_from",
      "effective_to",
      "known_from",
      "known_to",
      "source_evidence_ref",
      "mapping_confidence"
    ],
    "mutable_fields": [],
    "invariants": [
      "effective_from <= effective_to when effective_to is present",
      "known_from <= known_to when known_to is present",
      "overlapping known assignments for one symbol cannot resolve to multiple instruments"
    ]
  }
}
