{"created_at":"2026-10-07T22:03:52Z","currency":"USD","effective_from":"2026-10-07","effective_to":null,"environment_namespace":"production","evidence_class":"FORWARD_OPERATIONAL","exchange":"ARCA","id":"01a11864-f825-71bc-8f0c-9a96f67f219b","instrument_ref":{"target_id":"01a11864-f823-76aa-83e6-0622b99c8b7a","target_schema_name":"qc2.identity_market.Instrument.v1"},"known_from":"2026-10-07T22:03:52Z","known_to":null,"mapping_confidence":"1.000000000000","owning_authority":"instrument_universe","schema_name":"qc2.identity_market.SymbolAssignment.v1","schema_version":"1.0","source_evidence_ref":{"content_hash":"d17915f89a8c5e9eb760ad6514192d8816792b265a16e7cc7085e8438eaa4293","target_id":"01a11864-f817-77c0-9435-6923e03d5f52","target_schema_name":"qc2.integrity_build.EvidenceEvent.v1"},"source_refs":[{"content_hash":"d17915f89a8c5e9eb760ad6514192d8816792b265a16e7cc7085e8438eaa4293","target_id":"01a11864-f817-77c0-9435-6923e03d5f52","target_schema_name":"qc2.integrity_build.EvidenceEvent.v1"}],"symbol":"SPY"}